{
  "archetypes": [
    "Bridge Route"
  ],
  "brief": "A bounded bridge mission that starts from Nirvana's body-and-pressure core, tests source-code and working-band bridges, then probes current rock that still has pulse without sliding into post-grunge slop or fake-hard posture.",
  "completion_criteria": {
    "chip_selection_policy": "Use chip selections to refine meaning after the primary reaction; chips do not replace primary reactions and should preserve uncertainty.",
    "completion_logic": "Complete after all 7 route items have primary reactions and at least 10 chip selections total, with trap-item chips interpreted using exception/boundary logic rather than broad lane promotion.",
    "min_chip_selections_for_summary": 10,
    "min_items_to_play": 7,
    "min_primary_reactions": 7,
    "primary_reaction_policy": "Collect one primary reaction per route item. Primary reactions are separate from chip selections and must be recorded for every played item."
  },
  "completion_summary_inputs": [
    {
      "input_id": "summary_primary_reactions",
      "prompt": "Summarize the primary reactions across the 7-item route, especially the transition from Nirvana to current rock.",
      "source": "route_item_primary_reactions"
    },
    {
      "input_id": "summary_chip_selections",
      "prompt": "Summarize which chip signals repeated, especially body, current pulse, fake-hard, and post-grunge slop boundaries.",
      "source": "chip_selections"
    },
    {
      "input_id": "summary_route_item_reactions",
      "prompt": "Summarize item-by-item route behavior, including the trap boundary check and the current endpoint probe.",
      "source": "route_item_reactions"
    }
  ],
  "hypothesis": "The user will keep responding to body-first guitar pressure, hooks under pressure, and production that reveals identity; current rock can work if it feels lived-in and not like a genre appliance.",
  "mission_id": "nirvana_to_current",
  "possible_atlas_update_candidates": [
    {
      "atlas_role": "Landmark",
      "candidate_id": "NIR_CUR_001",
      "confidence": "medium",
      "rationale": "Selected anchor item can support a stable Landmark seed only if body-first and pressure-hook signals recur in future reviewed reactions.",
      "review_required": true,
      "trigger_conditions": [
        {
          "condition_id": "cond_nir_cur_001_repeat_body",
          "condition_text": "If future reactions to Nirvana items repeatedly show body-force and hooks-under-pressure, keep the anchor as a stable Landmark seed candidate for review.",
          "future_reaction_operations": [
            "love",
            "like"
          ],
          "minimum_occurrences": 2,
          "required_signal": "body_force"
        }
      ]
    },
    {
      "atlas_role": "Frontier",
      "candidate_id": "NIR_CUR_005",
      "confidence": "medium",
      "rationale": "This selected current-rock probe is mission-scoped evidence only; repeated positive current-pulse reactions could justify a Frontier proposal after review.",
      "review_required": true,
      "trigger_conditions": [
        {
          "condition_id": "cond_nir_cur_005_repeat_current",
          "condition_text": "If future reactions repeatedly show current-rock pulse and body on this item or close current probes, consider a Frontier candidate for review.",
          "future_reaction_operations": [
            "love",
            "like"
          ],
          "minimum_occurrences": 2,
          "required_signal": "current_rock_has_pulse"
        }
      ]
    },
    {
      "atlas_role": "Dead End",
      "candidate_id": "NIR_CUR_009",
      "confidence": "medium",
      "rationale": "This trap item is explicitly a dead-end check; repeated negative boundary reactions can support a Dead End candidate, but only with review.",
      "review_required": true,
      "trigger_conditions": [
        {
          "condition_id": "cond_nir_cur_009_dead_end_repeat",
          "condition_text": "If future boundary checks repeatedly hit post-grunge slop and fake-hard on this trap item, keep it as a Dead End candidate under review.",
          "future_reaction_operations": [
            "not_for_me"
          ],
          "minimum_occurrences": 2,
          "required_signal": "post_grunge_slop"
        }
      ]
    },
    {
      "atlas_role": "Frontier",
      "candidate_id": "NIR_CUR_007",
      "confidence": "low",
      "rationale": "This is a current heavy-melodic checkpoint; repeated positive evidence could support Frontier status, but not Landmark promotion.",
      "review_required": true,
      "trigger_conditions": [
        {
          "condition_id": "cond_nir_cur_007_repeat_current_body",
          "condition_text": "If future reactions repeatedly show current pulse plus body on this heavy current item, keep it as a Frontier candidate rather than promoting it to a Landmark.",
          "future_reaction_operations": [
            "love",
            "like"
          ],
          "minimum_occurrences": 2,
          "required_signal": "current_rock_has_pulse"
        }
      ]
    }
  ],
  "review_config": {
    "default_item_review_needed_for": [
      "risky",
      "trap",
      "dead_end_check",
      "frontier_unknown"
    ],
    "frontier_or_trap_review_policy": "Review all risky, trap, dead_end_check, and frontier_unknown items before any Atlas promotion. Trap positives must be treated as bounded exceptions or reassess-dead-end signals, not as lane proof.",
    "notes": "Mission is candidate-constrained and intentionally preserves uncertainty. No item should be promoted beyond Signal only or Waypoint without recurrence and review.",
    "ready_for_app_import": false,
    "requires_human_review": true,
    "review_focus": [
      "body-first pressure",
      "current rock pulse",
      "fake-hard boundary",
      "post-grunge slop boundary",
      "waypoint not Landmark"
    ]
  },
  "risk_model": {
    "candidate_policy": "Prefer route logic over sounds-like matching; use candidate pool only, exclude trap rows unless explicitly used as boundary checks.",
    "known_traps_acknowledged": [
      "Adult Alternative / VH1 Sincerity Lane",
      "Post-Grunge Trap Item",
      "Seether-style fake-hard lane"
    ],
    "overall_risk": "medium",
    "uncertainty_notes": [
      "Candidate pool is present, so all route items are drawn only from the provided candidates.",
      "The route stays within the requested item-count range and uses trap rows only as explicit boundary checks.",
      "Current-rock evidence remains provisional; one positive reaction should not be inflated into broad appetite.",
      "Trap positives, if any, should be interpreted as exception/cultural furniture/reassess-dead-end signals, not as proof the dead end is gone."
    ]
  },
  "route": {
    "intended_item_count": 7,
    "items": [
      {
        "candidate_id": "NIR_CUR_001",
        "display_metadata": {
          "album": "In Utero",
          "artist": "Nirvana",
          "release_year": 1993,
          "title": "Serve the Servants"
        },
        "expected_features": [
          "body_force",
          "hooks_under_pressure",
          "production_reveals_identity"
        ],
        "expected_negative_signal": "Feels like familiar canon without present-tense pull, or the body is there but the song feels stale.",
        "expected_positive_signal": "Body lands immediately; the mix feels alive, not slop; hooks carry pressure rather than polish.",
        "familiarity_assumption": "deeply_known",
        "feedback_chip_sets": {
          "keep": [
            {
              "atlas_effect_hint": "Prevents overgeneralizing from one anchor listen.",
              "chip_id": "r1_keep_waypoint_not_landmark",
              "chip_type": "route_signal",
              "label": "Waypoint, not Landmark",
              "mapped_canonical_feature_id": "waypoint_not_landmark",
              "reaction_operation": "keep",
              "signal_meaning": "This remains an anchor for the route, but the chip keeps the scope bounded.",
              "uses_user_vocabulary": true,
              "weight_hint": "low"
            },
            {
              "atlas_effect_hint": "Marks clean production that still has blood.",
              "chip_id": "r1_keep_no_slop",
              "chip_type": "feature_signal",
              "label": "no slop",
              "mapped_canonical_feature_id": "polished_but_not_slop",
              "reaction_operation": "keep",
              "signal_meaning": "The recording stays alive and specific rather than mushy or generic.",
              "uses_user_vocabulary": true,
              "weight_hint": "low"
            }
          ],
          "like": [
            {
              "atlas_effect_hint": "Adds moderate support for body-first taste.",
              "chip_id": "r1_like_physical_pull",
              "chip_type": "feature_signal",
              "label": "physical pull",
              "mapped_canonical_feature_id": "body_force",
              "reaction_operation": "like",
              "signal_meaning": "The song has body and motion, even if it is not top-tier core.",
              "uses_user_vocabulary": true,
              "weight_hint": "medium"
            },
            {
              "atlas_effect_hint": "Supports the idea that production can clarify identity on this route.",
              "chip_id": "r1_like_identity_sharp",
              "chip_type": "feature_signal",
              "label": "identity sharpened",
              "mapped_canonical_feature_id": "production_reveals_identity",
              "reaction_operation": "like",
              "signal_meaning": "The production reveals the band rather than flattening them.",
              "uses_user_vocabulary": false,
              "weight_hint": "medium"
            }
          ],
          "love": [
            {